{
  "schema_version": "hdp.cms-pdc.v1",
  "record_type": "cms_pdc_receipt",
  "receipt_id": "receipt:cms:pdc:1111111111111111111111111111111111111111111111111111111111111111",
  "idempotency_key": "replay:cms:pdc:2222222222222222222222222222222222222222222222222222222222222222",
  "state": "schema_drift",
  "change_kind": "schema_drift",
  "source_id": "source:cms:pdc",
  "dataset_id": "xubh-q36u",
  "distribution_id": "xubh-q36u-csv",
  "release_id": "release:cms:pdc:2026-08-29",
  "release_fingerprint": "sha256:3333333333333333333333333333333333333333333333333333333333333333",
  "content_sha256": null,
  "prior_release_fingerprint": "sha256:cccccccccccccccccccccccccccccccccccccccccccccccccccccccccccccccc",
  "prior_content_sha256": "sha256:dddddddddddddddddddddddddddddddddddddddddddddddddddddddddddddddd",
  "prior_receipt_id": "receipt:cms:pdc:aaaaaaaaaaaaaaaaaaaaaaaaaaaaaaaaaaaaaaaaaaaaaaaaaaaaaaaaaaaaaaaa",
  "probe_state": "changed",
  "schema_state": "drift",
  "stream_state": "not_started",
  "acknowledged": false,
  "received_bytes": 0,
  "chunk_count": 0,
  "current_projection_preserved": true,
  "observed_at": "2026-08-29T00:00:00Z",
  "source_url": "https://data.cms.gov/provider-data/api/1/datastore/query",
  "distribution_url": "https://data.cms.gov/provider-data/sites/default/files/resources/xubh-q36u.csv",
  "error": "schema_drift"
}
