{
  "schema_version": "hdp.cms-pdc.v1",
  "record_type": "cms_pdc_receipt",
  "receipt_id": "receipt:cms:pdc:aaaaaaaaaaaaaaaaaaaaaaaaaaaaaaaaaaaaaaaaaaaaaaaaaaaaaaaaaaaaaaaa",
  "idempotency_key": "replay:cms:pdc:bbbbbbbbbbbbbbbbbbbbbbbbbbbbbbbbbbbbbbbbbbbbbbbbbbbbbbbbbbbbbbbb",
  "state": "changed",
  "change_kind": "release",
  "source_id": "source:cms:pdc",
  "dataset_id": "xubh-q36u",
  "distribution_id": "xubh-q36u-csv",
  "release_id": "release:cms:pdc:2026-08-29",
  "release_fingerprint": "sha256:cccccccccccccccccccccccccccccccccccccccccccccccccccccccccccccccc",
  "content_sha256": "sha256:dddddddddddddddddddddddddddddddddddddddddddddddddddddddddddddddd",
  "prior_release_fingerprint": null,
  "prior_content_sha256": null,
  "prior_receipt_id": null,
  "probe_state": "changed",
  "schema_state": "valid",
  "stream_state": "completed",
  "acknowledged": true,
  "received_bytes": 18,
  "chunk_count": 2,
  "current_projection_preserved": false,
  "observed_at": "2026-08-29T00:00:00Z",
  "source_url": "https://data.cms.gov/provider-data/api/1/datastore/query",
  "distribution_url": "https://data.cms.gov/provider-data/sites/default/files/resources/xubh-q36u.csv",
  "error": null
}
