{
  "schema_version": "hdp.cms-pdc.v1",
  "record_type": "cms_pdc_receipt",
  "receipt_id": "receipt:cms:pdc:6666666666666666666666666666666666666666666666666666666666666666",
  "idempotency_key": "replay:cms:pdc:7777777777777777777777777777777777777777777777777777777777777777",
  "state": "interrupted",
  "change_kind": "interrupted",
  "source_id": "source:cms:pdc",
  "dataset_id": "xubh-q36u",
  "distribution_id": "xubh-q36u-csv",
  "release_id": "release:cms:pdc:2026-08-29",
  "release_fingerprint": "sha256:8888888888888888888888888888888888888888888888888888888888888888",
  "content_sha256": "sha256:9999999999999999999999999999999999999999999999999999999999999999",
  "prior_release_fingerprint": null,
  "prior_content_sha256": null,
  "prior_receipt_id": null,
  "probe_state": "changed",
  "schema_state": "valid",
  "stream_state": "interrupted",
  "acknowledged": false,
  "received_bytes": 8,
  "chunk_count": 1,
  "current_projection_preserved": true,
  "observed_at": "2026-08-29T00:00:00Z",
  "source_url": "https://data.cms.gov/provider-data/api/1/datastore/query",
  "distribution_url": "https://data.cms.gov/provider-data/sites/default/files/resources/xubh-q36u.csv",
  "error": "stream_interrupted"
}
